{
  "schemaVersion": "1.0.0", "id": "synthetic-demo", "revision": 0,
  "label": "合成示範材質，非量測", "dataClass": "Synthetic", "sourceUrls": [],
  "conditions": "僅用於 energy-conservation fixture；相同阻抗，無材料實驗證據", "phaseModel": "zeroPhaseMagnitudeOnly",
  "bands": [{"centerHz": 1000, "absorptionEnergy": 0.2, "reflectionEnergy": 0.7, "transmissionEnergy": 0.1, "scatteringFraction": 0.1}]
}
